{
  "schema_version": 1,
  "target": {
    "jurisdiction": "132039",
    "fiscal_year": 2024,
    "document_kind": "settlement"
  },
  "direction": "expenditure",
  "conversions": [
    {
      "converter": "fiscal/layouts/generic_text/convert.py",
      "expected_tables": [
        {
          "table_id": "general-expenditure"
        }
      ],
      "id": "general-settlement",
      "inputs": [
        {
          "sha256": "3e8e7803167c66a76efd31d364d80f82c511dd2e7e391a4b8ef68ba526be8b45"
        }
      ],
      "options": {
        "account": "一般会計",
        "table_id": "general-expenditure"
      }
    },
    {
      "id": "national-health-insurance-settlement",
      "converter": "fiscal/layouts/generic_text/convert.py",
      "inputs": [
        {
          "sha256": "e6132d40f1ea2e63274cb760ea2907f8dfb009d69a87ddff90c22c8c5c2b8bca"
        }
      ],
      "options": {
        "account": "国民健康保険事業会計",
        "table_id": "national-health-insurance-expenditure"
      },
      "expected_tables": [
        {
          "table_id": "national-health-insurance-expenditure"
        }
      ]
    },
    {
      "id": "long-term-care-settlement",
      "converter": "fiscal/layouts/generic_text/convert.py",
      "inputs": [
        {
          "sha256": "6a7153fec8d09f9faf50326191f7420181eb3b1cc3d20b4a7eb6749a2d007cef"
        }
      ],
      "options": {
        "account": "介護保険事業会計",
        "table_id": "long-term-care-expenditure"
      },
      "expected_tables": [
        {
          "table_id": "long-term-care-expenditure"
        }
      ]
    },
    {
      "converter": "fiscal/jurisdictions/132039/layouts/text_settlement/convert.py",
      "expected_tables": [
        {
          "table_id": "kouki-expenditure-detail"
        }
      ],
      "id": "kouki-settlement",
      "inputs": [
        {
          "sha256": "4a9ed20e2219f0a39b06d87a1d238db73b7380cbe57fd5ab651bca27e0c69e3b"
        }
      ],
      "options": {
        "account": "後期高齢者医療会計",
        "detail_pages": [
          [
            1,
            3
          ]
        ],
        "table_id": "kouki-expenditure-detail"
      }
    }
  ],
  "tables": [
    {
      "table_id": "general-expenditure",
      "conversion_id": "general-settlement",
      "input_fingerprint": "3c75dbbe0fb6bc481bb93392a5d4bc6396f9483bd498f08488e78563bee12985",
      "account": "一般会計",
      "notes": [
        "汎用のノード生成機（docs/prd/generic-node-builder）が選定の scope の頁を罫線・見出し・字下げ・番号から読んだ。科目の段は bands、内訳の段は {'節': 'indent', '備考': 'indent'}。",
        "金額の単位は column mark 91頁 から決めた。款の和 86,395,950,790 と印字の「歳出合計」86,395,950,790 が一致。",
        "金額の注記 36 件（不用額 15・充用 19・流用 2）を注記軸に置いた。",
        "共有辞書に無い金額の見出し 1 種（992 件）を、印字された語から辞書の見出しに寄せた: 金額→節／金額。"
      ],
      "unread_amount_count": 0,
      "unresolved_parent_count": 0,
      "nodes": {
        "object": {
          "key": "fiscal/ingestion/132039/2024/settlement/expenditure/general-expenditure-nodes.parquet",
          "sha256": "30a94afe4514c195fae399d6ad1eb403dad0dfeaad5f052b48d15fc9fdd1018f",
          "bytes": 167265
        },
        "row_count": 4816
      },
      "amounts": {
        "object": {
          "key": "fiscal/ingestion/132039/2024/settlement/expenditure/general-expenditure-amounts.parquet",
          "sha256": "cb0ba0d5dbba8b85e8224742458c2c8e5e9e6f8c23deb0b0c07e4c4edb21df5b",
          "bytes": 177712
        },
        "row_count": 8849
      }
    },
    {
      "table_id": "national-health-insurance-expenditure",
      "conversion_id": "national-health-insurance-settlement",
      "input_fingerprint": "2d605f07df29082c73858100fb8ec913f844bd292643631cd99da34611061a20",
      "account": "国民健康保険事業会計",
      "notes": [
        "汎用のノード生成機（docs/prd/generic-node-builder）が選定の scope の頁を罫線・見出し・字下げ・番号から読んだ。科目の段は bands、内訳の段は {'節': 'indent', '備考': 'indent'}。",
        "金額の単位は column mark 7頁 から決めた。款の和 13,567,438,276 と印字の「歳出合計」13,567,438,276 が一致。",
        "金額の注記 2 件（流用 2）を注記軸に置いた。",
        "共有辞書に無い金額の見出し 1 種（47 件）を、印字された語から辞書の見出しに寄せた: 金額→節／金額。"
      ],
      "unread_amount_count": 0,
      "unresolved_parent_count": 0,
      "nodes": {
        "object": {
          "key": "fiscal/ingestion/132039/2024/settlement/expenditure/national-health-insurance-expenditure-nodes.parquet",
          "sha256": "9c752609762a112b01b71a0b8b3baa58a29bc43d714b4b3768be0858fa7f9d82",
          "bytes": 13290
        },
        "row_count": 208
      },
      "amounts": {
        "object": {
          "key": "fiscal/ingestion/132039/2024/settlement/expenditure/national-health-insurance-expenditure-amounts.parquet",
          "sha256": "0f540ab76fe932052fbdcaef28ff83bbd2a91fdcc15d827bd4276608cdac69e7",
          "bytes": 18624
        },
        "row_count": 720
      }
    },
    {
      "table_id": "long-term-care-expenditure",
      "conversion_id": "long-term-care-settlement",
      "input_fingerprint": "560b94cd3b95f292b37809c808afa789bf365cc31c2551e92e27c5cf7e19cc98",
      "account": "介護保険事業会計",
      "notes": [
        "汎用のノード生成機（docs/prd/generic-node-builder）が選定の scope の頁を罫線・見出し・字下げ・番号から読んだ。科目の段は bands、内訳の段は {'節': 'indent', '備考': 'indent'}。",
        "金額の単位は column mark 5頁 から決めた。款の和 12,644,756,513 と印字の「歳出合計」12,644,756,513 が一致。",
        "金額の注記 2 件（流用 2）を注記軸に置いた。",
        "共有辞書に無い金額の見出し 1 種（48 件）を、印字された語から辞書の見出しに寄せた: 金額→節／金額。"
      ],
      "unread_amount_count": 0,
      "unresolved_parent_count": 0,
      "nodes": {
        "object": {
          "key": "fiscal/ingestion/132039/2024/settlement/expenditure/long-term-care-expenditure-nodes.parquet",
          "sha256": "a056b52722468b55ee3ea0fd95385e1b7fe7630abeaf4b519e410d61e6ad4a09",
          "bytes": 12102
        },
        "row_count": 190
      },
      "amounts": {
        "object": {
          "key": "fiscal/ingestion/132039/2024/settlement/expenditure/long-term-care-expenditure-amounts.parquet",
          "sha256": "6f520cb00736ae32b889ec77b7a26b0e98e6886f18cef320dbd092d234c59ee5",
          "bytes": 15518
        },
        "row_count": 516
      }
    },
    {
      "table_id": "kouki-expenditure-detail",
      "conversion_id": "kouki-settlement",
      "input_fingerprint": "d45512395b40f63763aee4a60bcdd14f3245a4ae486b98b91692e16579ec9502",
      "account": "後期高齢者医療会計",
      "notes": [
        "武蔵野市後期高齢者医療会計の決算事項別明細書（歳出）。款・項・目の印字欄を所属する葉へ反復。最細は法定節（節がない予備費目は目）。節一覧と備考は同じ目の独立した分解であり相互の対応を推定していない。目_備考は目の備考欄の原文（□事業・○経費・積算）。金額は円の原表記（△は減額符号）。歳出合計はlocal観測に残しraw行にしない。",
        "旧変換器は未読・所属未確認を数えていない。件数は移行時に検出できた原文の未読と親の未解決を数え、0の根拠は段階を解決できる印字金額の親子について全段の子の和の一致である。原典の未抽出箇所が無いことの証明ではない。"
      ],
      "unread_amount_count": 0,
      "unresolved_parent_count": 0,
      "nodes": {
        "object": {
          "key": "fiscal/ingestion/132039/2024/settlement/expenditure/kouki-expenditure-detail-nodes.parquet",
          "sha256": "5e5abddde4b5753875e8d3716389e72028090d63deea7f54ec83538f1385ddb5",
          "bytes": 4890
        },
        "row_count": 42
      },
      "amounts": {
        "object": {
          "key": "fiscal/ingestion/132039/2024/settlement/expenditure/kouki-expenditure-detail-amounts.parquet",
          "sha256": "cc2681d46953f15dccb8bca650c2ff3581e7fc9505240be9c4c96a3f3f67e516",
          "bytes": 7842
        },
        "row_count": 240
      }
    }
  ]
}
