{
  "schema_version": 1,
  "target": {
    "jurisdiction": "132071",
    "fiscal_year": 2025,
    "document_kind": "initial"
  },
  "direction": "expenditure",
  "conversions": [
    {
      "id": "akishima-text-budget-expenditure",
      "converter": "fiscal/layouts/workflow_text/convert.py",
      "inputs": [
        {
          "sha256": "4662197051b0ec0d9c50e1690c5804d0b31e17dd7d35b972fd272e03068507f8"
        }
      ],
      "options": {
        "table_id": "akishima-text-budget-expenditure",
        "detail_pages": [
          108,
          449
        ],
        "workflow": {
          "reading": {
            "pattern": "profiled_budget",
            "profile": "fiscal/jurisdictions/132071/layouts/text_budget/reading.json"
          },
          "components": [
            "page_context"
          ]
        }
      },
      "expected_tables": [
        {
          "table_id": "akishima-text-budget-expenditure"
        }
      ]
    }
  ],
  "tables": [
    {
      "table_id": "akishima-text-budget-expenditure",
      "conversion_id": "akishima-text-budget-expenditure",
      "input_fingerprint": "ea7db10683009d910bb91968f879f620c15629aa02ade6bd751de9d79b6254c8",
      "account": "一般会計",
      "notes": [
        "科目、説明、節の区分、財源内訳は独立した印字欄。空欄を0に置換しない。",
        "旧変換器は未読・所属未確認を数えていない。件数は移行時に検出できた原文の未読と親の未解決を数え、0の根拠は段階を解決できる印字金額の親子について全段の子の和の一致である。原典の未抽出箇所が無いことの証明ではない。"
      ],
      "unread_amount_count": 0,
      "unresolved_parent_count": 0,
      "nodes": {
        "object": {
          "key": "fiscal/ingestion/132071/2025/initial/expenditure/akishima-text-budget-expenditure-nodes.parquet",
          "sha256": "43409c842fe846a109e7af5a1c3c2741870eaef1f82ef6b3d76030af3588167c",
          "bytes": 199690
        },
        "row_count": 7060
      },
      "amounts": {
        "object": {
          "key": "fiscal/ingestion/132071/2025/initial/expenditure/akishima-text-budget-expenditure-amounts.parquet",
          "sha256": "f4565766fd03584cf934096a389851e817f9f5a3d97f502e9dc183c7dfb768c8",
          "bytes": 149468
        },
        "row_count": 7629
      }
    }
  ]
}
