{
  "schema_version": 1,
  "target": {
    "jurisdiction": "132136",
    "fiscal_year": 2025,
    "document_kind": "settlement"
  },
  "direction": "expenditure",
  "conversions": [
    {
      "id": "general-settlement",
      "converter": "fiscal/layouts/generic_text/convert.py",
      "inputs": [
        {
          "sha256": "b5f53e4eeb2cf4358c3544d6f8f16c7f91436bd34d5725443945a7763b1a1d05"
        }
      ],
      "options": {
        "account": "一般会計",
        "table_id": "general-expenditure"
      },
      "expected_tables": [
        {
          "table_id": "general-expenditure"
        }
      ]
    }
  ],
  "tables": [
    {
      "table_id": "general-expenditure",
      "conversion_id": "general-settlement",
      "input_fingerprint": "9af8ee403b615a68f9424c9900ba2f3885c0bb09a2384bca42357b3a24f5bdc6",
      "account": "一般会計",
      "notes": [
        "汎用のノード生成機（docs/prd/generic-node-builder）が選定の scope の頁を罫線・見出し・字下げ・番号から読んだ。科目の段は bands、内訳の段は {'備考': 'indent', '節': 'indent'}。",
        "金額の単位は printed 133頁 から決めた。款の和 73,193,786,413 と印字の「歳出合計」73,193,786,413 が一致。",
        "金額の注記 128 件（充用 4・流用 124）を注記軸に置いた。",
        "共有辞書に無い金額の見出し 7 種（6825 件）を、印字された語から辞書の見出しに寄せた: 不額／用→不用額・予現額／算／節／金額→節／金額・予現額／算／継続費及び／繰越事業費越／額／繰→予算現額／継続費及び繰越事業費繰越額・予現額／算／補正予算額→予算現額／補正予算額・翌年度越額／繰／故越し／事／繰→翌年度繰越額／事故繰越し・翌年度越額／繰／継逓／続／費／次越／繰→翌年度繰越額／継続費逓次繰越・翌年度越額／繰／越／繰明／許／費→翌年度繰越額／繰越明許費。"
      ],
      "unread_amount_count": 0,
      "unresolved_parent_count": 0,
      "nodes": {
        "object": {
          "key": "fiscal/ingestion/132136/2025/settlement/expenditure/general-expenditure-nodes.parquet",
          "sha256": "33561ffe102aa350a1cc34f6d34238287688672211c652fbc148e65f3b3f83be",
          "bytes": 192790
        },
        "row_count": 6823
      },
      "amounts": {
        "object": {
          "key": "fiscal/ingestion/132136/2025/settlement/expenditure/general-expenditure-amounts.parquet",
          "sha256": "9c74c3e49ab74c164a40894e21ae7f61eaf45703324d571ed083f84af8c7f0fd",
          "bytes": 166360
        },
        "row_count": 14098
      }
    }
  ]
}
